"StationaryProcess","Brake Fluid Production",35039679,"Brake Fluid","Brake Fluid Fabrication","30125301;30610001",,,,,,,,"Glycol ether OR petroleum based lubricant",
"StationaryProcess","Transmission Fluid Production",35039700,"Transmission Fluid","Transmission Fluid Fabrication","30630005;30630006;30630007",,,,,,,,,
"StationaryProcess","Sodium Carbonate Production (Soda Ash) in US",35043845,"Sodium Carbonate","Soda Ash Production for use in US","30102102;30102103;30102104;30102106;30102107;30102108;30102113;30102114;30102121;30102122;30102123;30102124;30102125;30102126;30102127;30102199",,,,,,,,,
"StationaryProcess","Concentrated Li Brine Production - Chile",35047291,"Concentrated Li Brine","Production of lithium manganese oxide with Virgin Li2CO3 from Chile,Lithium iron phosphate (solid state),Production of lithium cobalt oxide (solid state),Lithium Carbonate Production in Chile,Production of LMR-NMC","30400502;30400503;30400507;30400508;30400512;30400513;30400521;30400522;30400523;30400524;30400525;30400526;30400527;30400528;30400530;30400599",,99920100,,,99950200,,,,
"StationaryProcess","Corn Stover Field Treatment, Drying, Collection, Handling and Storage",38319265,"Corn Stover","Corn Stover for Ethanol Plant",2801000000,,,,,99950200,,,,
"StationaryProcess","US average Ethanol Production from Corn Stover",51188980,"Ethanol","Ethanol Production from Corn Stover","30205010;30205011;30205012;30205013;30205014;30205020;30205021;30205030;30205031;30205032;30205033;30205034;30205035;30205038;30205039;30205040;30205041;30205050;30205051;30205052;30205053;30205054;30205091",,,,,,,,,
"StationaryProcess","US Industry Average Ethanol Production from Corn",51189067,"Ethanol","Ethanol Production from Corn","30205010;30205011;30205012;30205013;30205014;30205020;30205021;30205030;30205031;30205032;30205033;30205034;30205035;30205038;30205039;30205040;30205041;30205050;30205051;30205052;30205053;30205054;30205091",,,,,,,,,
"StationaryProcess","US average Ethanol Production from Forest Residue",51189156,"Ethanol","Ethanol Production from Forest Residue","30205010;30205011;30205012;30205013;30205014;30205020;30205021;30205030;30205031;30205032;30205033;30205034;30205035;30205038;30205039;30205040;30205041;30205050;30205051;30205052;30205053;30205054;30205091",,,,,,,,,
"StationaryProcess","US average Ethanol Production from Miscanthus",51189198,"Ethanol","Ethanol Production from Miscanthus","30205010;30205011;30205012;30205013;30205014;30205020;30205021;30205030;30205031;30205032;30205033;30205034;30205035;30205038;30205039;30205040;30205041;30205050;30205051;30205052;30205053;30205054;30205091",,,,,,,,,
"StationaryProcess","US average Ethanol Production from Poplar",51189228,"Ethanol","Ethanol Production from Poplar","30205010;30205011;30205012;30205013;30205014;30205020;30205021;30205030;30205031;30205032;30205033;30205034;30205035;30205038;30205039;30205040;30205041;30205050;30205051;30205052;30205053;30205054;30205091",,,,,,,,,
"StationaryProcess","US average Ethanol Production from Sorghum",51189277,"Ethanol","Ethanol Production from Sorghum","30205010;30205011;30205012;30205013;30205014;30205020;30205021;30205030;30205031;30205032;30205033;30205034;30205035;30205038;30205039;30205040;30205041;30205050;30205051;30205052;30205053;30205054;30205091",,,,,,,,,
"StationaryProcess","US average Ethanol Production from Switchgrass",51189315,"Ethanol","Ethanol Production from Switchgrass","30205010;30205011;30205012;30205013;30205014;30205020;30205021;30205030;30205031;30205032;30205033;30205034;30205035;30205038;30205039;30205040;30205041;30205050;30205051;30205052;30205053;30205054;30205091",,,,,,,,,
"StationaryProcess","US average Ethanol Production from Willow",51189342,"Ethanol","Ethanol Production from Willow","30205010;30205011;30205012;30205013;30205014;30205020;30205021;30205030;30205031;30205032;30205033;30205034;30205035;30205038;30205039;30205040;30205041;30205050;30205051;30205052;30205053;30205054;30205091",,,,,,,,,
"StationaryProcess","Ethanol Denaturing",51381690,"Ethanol Denatured","Ethanol Denatured Produced in the US (at the Bulk Terminal),Ethanol Denatured Produced in Brazil (at the Bulk Terminal),Ethanol Denatured Produced in CA (at the Bulk Terminal)",30125001,,,,,,,,"I've just used the code for methanol production.",
"StationaryProcess","Reformulated Gasoline (E10) Production via Blending",51792806,"E10","Reformulated Gasoline (E10) Blending and Transportation to Refueling Station",30602201,,,,,,,,"Not really sure what a gasoline blending unit is. Is it somewhere where EX blends are made? At any rate, this process has no emissions.",
"StationaryProcess","Ethanol E85 Production via blending",52332958,"E85","E85 Gasoline Blending and Transportation to Refueling Station ",30602201,,,,,,,,,
"StationaryProcess","US average Oil-Fired Power Generation",52672010,"Electricity","Non Distributed - Oil-Fired Power Generation","20100101;20100102;20100105;20100106;20100107;20100108;20100109;10300401;10300402;10300403;10300404;10300501;10300502;10300503;10300504",,,,,,,,,
"StationaryProcess","US average Coal-Fired Power Generation",52672600,"Electricity","Non Distributed - Coal-Fired Power Generation","10100101;10100102;10100201;10100202;10100203;10100204;10100205;10100212;10100215;10100217;10100218;10100221;10100222;10100223;10100224;10100225;10100226;10100237;10100238;10100301;10100302;10100303;10100306;10100317;10100318;20100301",,,,,,,,,
"StationaryProcess","US average NG-Fired Power Generation",52677767,"Electricity","Non Distributed - Natural Gas-Fired Power Generation,Non Distributed - Canadian Natural Gas-Fired Power Generation","20100201;10100601;10100602;10100604",,,,,,,,,
"StationaryProcess","Averaged Ethanol Produced in the US",52933450,"Ethanol","Ethanol Produced in the US for Gasoline Blending","30205010;30205011;30205012;30205013;30205014;30205020;30205021;30205030;30205031;30205032;30205033;30205034;30205035;30205038;30205039;30205040;30205041;30205050;30205051;30205052;30205053;30205054;30205091",,,,,,,,,
"StationaryProcess","US average for Denatured Ethanol",53023032,"Ethanol Denatured",,30125001,,,,,,,,"I've just used the code for methanol production.",
"StationaryProcess","US average Other Power Generation ",53106798,"Electricity","Non Distributed - Other Power Generation Plants ","10100101;10100102;10100201;10100202;10100203;10100204;10100205;10100212;10100215;10100217;10100218;10100221;10100222;10100223;10100224;10100225;10100226;10100237;10100238;10100301;10100302;10100303;10100306;10100317;10100318;10100401;10100404;10100405;10100406;10100501;10100504;10100505;10100601;10100602;10100604;10100701;10100702;10100703;10100712;10100801;10100901;10100902;10100903;10100908;10100910;10100911;10100912;10101001;10101002;10101101;10101201;10101202;10101204;10101206;10101207;10101208;10101301;10101302;10101501;10101502;10101601;10102101;20100101;20100102;20100105;20100106;20100107;20100108;20100109;20100201;20100202;20100205;20100206;20100207;20100208;20100209;20100301;20100702;20100707;20100801;20100802;20100805;20100807;20100809;20100901;20100902;20100907;20100908;20100909;20101001;20101020;20101030;20101031;20101302",,,,,,,,"I haven't looked to GREET to see what 'other' refers to, but as an approximation, I have included ALL SCC involved with electricity generation",
"StationaryProcess","US average Nuclear Power Generation",53277066,"Electricity","Non Distributed - Nuclear Power Generation","10100101;10100102;20100101;20100102;20100105;20100106;20100107;20100108;20100109",,99920700,,,,,,,
"StationaryProcess","US average Forest Residue Power Generation ",53538123,"Electricity","Non Distributed - Biomass Power Generation","10100901;10100902;10100903;10100908;10100910;10100911;10100912",,,,,,,,"I'm taking forest residue biomass to be the same as wood/bark waste",
"StationaryProcess","US average Willow Power Generation ",53538449,"Electricity","Non Distributed - Biomass Power Generation","10100901;10100902;10100903;10100908;10100910;10100911;10100912",,,,,,,,"I'm taking forest residue biomass to be the same as wood/bark waste",
"StationaryProcess","US average Poplar Power Generation ",53538454,"Electricity","Non Distributed - Biomass Power Generation","10100901;10100902;10100903;10100908;10100910;10100911;10100912",,,,,,,,"I'm taking forest residue biomass to be the same as wood/bark waste",
"StationaryProcess","US average Switchgrass Power Generation ",53538461,"Electricity","Non Distributed - Biomass Power Generation",10101207,,,,,,,,"10101210 stoker",
"StationaryProcess","US average Miscanthus Power Generation ",53538467,"Electricity","Non Distributed - Biomass Power Generation",10101207,,,,,,,,"10101210 stoker",
"StationaryProcess","Willow (Steam Turbine) Power Plant",53539208,"Electricity","Non Distributed - Biomass Power Generation","10100901;10100902;10100903;10100908;10100910;10100911;10100912;10200901;10200902;10200903;10200904;10200905;10200906;10200907;10200908;10200910;10200911;10200912",,,,,,,,,
"StationaryProcess","Willow IGCC Power Plant",53539244,"Electricity","Non Distributed - Biomass Power Generation","10100901;10100902;10100903;10100908;10100910;10100911;10100912",,,,,,,,"I'm taking forest residue biomass to be the same as wood/bark waste. This explains IGCC: https://www.duke-energy.com/about-us/how-igcc-works.asp It is BOTH an ""internal combustion engine"" and an ""external combustion boiler"", because the syngas drives an (internal) combustion turbine, and the steam drives an (external) steam turbine generator. BUT the only codes listed for electricity generation from woody biomass seem to be external, so I'm not going to worry too much about this.",
"StationaryProcess","US average Biomass Power Generation",53539337,"Electricity","Non Distributed - Biomass Power Generation",10101207,,,,,,,,"10101210 stoker",
"StationaryProcess","Poplar (Steam Turbine) Power Plant",53539379,"Electricity","Non Distributed - Biomass Power Generation","10100901;10100902;10100903;10100908;10100910;10100911;10100912",,,,,,,,"I'm taking forest residue biomass to be the same as wood/bark waste",
"StationaryProcess","Poplar IGCC Power Plant",53539437,"Electricity","Non Distributed - Biomass Power Generation","10100901;10100902;10100903;10100908;10100910;10100911;10100912",,,,,,,,"I'm taking forest residue biomass to be the same as wood/bark waste.This explains IGCC: https://www.duke-energy.com/about-us/how-igcc-works.asp It is BOTH an ""internal combustion engine"" and an ""external combustion boiler"", because the syngas drives an (internal) combustion turbine, and the steam drives an (external) steam turbine generator. BUT the only codes listed for electricity generation from woody biomass seem to be external, so I'm not going to worry too much about this.",
"StationaryProcess","Miscanthus (Steam Turbine) Power Plant",53540183,"Electricity","Non Distributed - Biomass Power Generation",10101207,,,,,,,,,
"StationaryProcess","Miscanthus IGCC Power Plant",53540213,"Electricity","Non Distributed - Biomass Power Generation",10101207,,,,,,,,"This explains IGCC: https://www.duke-energy.com/about-us/how-igcc-works.asp It is BOTH an ""internal combustion engine"" and an ""external combustion boiler"", because the syngas drives an (internal) combustion turbine, and the steam drives an (external) steam turbine generator. BUT the only codes listed for electricity generation from woody biomass seem to be external, so I'm not going to worry too much about this.",
"StationaryProcess","US average RNG-Fired Power Generation",53625565,"Electricity","Other Purpose - RNG-Fired Power Generation (On-site)","20100201;20100202;20100205;20100206;20100207;20100208;20100209",,,,,,,,,
"StationaryProcess","US average Other Power Generation  (without Hydro)",54225891,"Electricity","Non Distributed - Other Power Generation Plants (without Hydro)","10100101;10100102;10100201;10100202;10100203;10100204;10100205;10100212;10100215;10100217;10100218;10100221;10100222;10100223;10100224;10100225;10100226;10100237;10100238;10100301;10100302;10100303;10100306;10100317;10100318;10100401;10100404;10100405;10100406;10100501;10100504;10100505;10100601;10100602;10100604;10100701;10100702;10100703;10100712;10100801;10100901;10100902;10100903;10100908;10100910;10100911;10100912;10101001;10101002;10101101;10101201;10101202;10101204;10101206;10101207;10101208;10101301;10101302;10101501;10101502;10101601;10102101;20100101;20100102;20100105;20100106;20100107;20100108;20100109;20100201;20100202;20100205;20100206;20100207;20100208;20100209;20100301;20100702;20100707;20100801;20100802;20100805;20100807;20100809;20100901;20100902;20100907;20100908;20100909;20101001;20101020;20101030;20101031;20101302",,,,,,,,,
"StationaryProcess","CA Reformulated Gasoline (E10) Production via Blending",54387493,"CA Reformulated Gasoline","CA Reformulated Gasoline (E10) to Refueling Station",30602201,,,,,,,,"Not really sure what a gasoline blending unit is. Is it somewhere where EX blends are made? At any rate, this process has no emissions.",
"StationaryProcess","Integrated Corn/Stover Ethanol (Combined Gallon)",54465875,"Ethanol","Ethanol Production from Corn and Corn stover (combined gallon)","30205010;30205011;30205012;30205013;30205014;30205020;30205021;30205030;30205031;30205032;30205033;30205034;30205035;30205038;30205039;30205040;30205041;30205050;30205051;30205052;30205053;30205054;30205091",,,,,,,,,
"StationaryProcess","Production of Potassium Nitrate",54907522,"Potassium Nitrate ","Production of Potassium Nitrate",30502299,,,,,,,,"These are all under ""potash"" production.",
"StationaryProcess","Production of Cobalt Nitrate",54917342,"Cobalt Nitrate","Production of Cobalt Nitrate","30302401;30302402;30302403;30302404;30302405;30302406;30302407;30302408;30302409;30302410;30302411",,,,,99951400,,,"THE US PRODUCES APPROXIMATELY NO COBALT, SO I'VE PUT THIS AS ABROAD. I think cobalt (I-II?) oxide is extracted from copper-cobalt oxide ore, as a byproduct of copper mining. But this is more general. NB If you are choosing between low and high moisture fairly arbitrarily, choose low: I've read that ores are often dried before entering a grinder .so the EF's are the same by dry weight.",
"StationaryProcess","Production of Nickel Nitrate",55006079,"Nickel Nitrate","Production of Nickel Nitrate","30401001;30401002;30401004;30401005;30401006;30401007;30401010;30401011;30401018;30401099",,,,,,,,,
"StationaryProcess","Production of Magnesium Nitrate",55006739,"Nickel Nitrate",,"30401001;30401002;30401004;30401005;30401006;30401007;30401010;30401011;30401018;30401099",,,,,,,,,
"StationaryProcess","Production of white phosphorous",55010020,"White phosphorous",,"30111201;30111202;30111299",,,,,,,,,
"StationaryProcess","Sand production",55010291,"Sand","Sand production",30502501,,,,,,,,,
"StationaryProcess","Production of white phosphorous",55337446,"White phosphorous","Production of white phosphorous","30111201;30111202;30111299",,,,,,,,,
"StationaryProcess","Production of PCl3",55338811,"PCl3","Production of PCl3",30111201,,,,,,,,"This is elemental phosphorous production.",
"StationaryProcess","Production of oxygen",55345020,"Oxygen","Production of oxygen",30107101,,,,,,,,"I just used hydrogen",
"StationaryProcess","Production of syngas from natural gas",55345278,"Syngas","Isobutanol from Fossil Energy (with Syngas from Natural Gas),1,3-Propanediol Production from Fossil Fuel (with Syngas from Natural Gas) Pathway,Production of syngas from Natural Gas","10100101;10100102;10100201;10100202;10100203;10100204;10100205;10100212;10100215;10100217;10100218;10100221;10100222;10100223;10100224;10100225;10100226;10100237;10100238;10100301;10100302;10100303;10100306;10100317;10100318;10100401;10100404;10100405;10100406;10100501;10100504;10100505;10100601;10100602;10100604;10100701;10100702;10100703;10100712;10100801;10100901;10100902;10100903;10100908;10100910;10100911;10100912;10101001;10101002;10101101;10101201;10101202;10101204;10101206;10101207;10101208;10101301;10101302;10101501;10101502;10101601;10102101",99910200,,,,,,,,
"StationaryProcess","MoS2 Mining",55353963,"MoS2","Production of MoS2",30301101,,,,,,,,"This is molybdenite, which is the principle ore of molybdenum, so it's probably the same as 'molybdenum mining'",
"StationaryProcess","Production of MoO3",55354401,"MoO3","Production of MoO3","30509201;30509202;30509203;30509204;30509205",,,,,,,,"Catalyst production, from MoS2.",
"StationaryProcess","Production of Na2S2O4",55354724,"Na2S2O4","Production of Na2S2O4",30113299,,,,,,,,"Dithionous acid is an organic acid, and this is the salt of this acid.",
"StationaryProcess","Production of Zinc",55354904,"Zinc","Production of Zinc","30303003;30303005;30303006;30303009;30303010;30303011;30303012;30303014;30303015;30303016;30303018;30303022;30303023;30303027;30303028;30303099",,,,,,,,,
"StationaryProcess","Production of (NH4)6Mo7O24",55356090,"Ammonium heptamolybdate","Production of (NH4)6Mo7O24","30301199;30630005;30630006;30630007",,99920300,,,,,,"http://www.thomasnet.com/products/ammonium-molybdate-1540608-1.html",
"StationaryProcess","Production of potassium phosphate",55421161,"Potassium Phosphate","Production of potassium phosphate",30502299,,,,,,,,"These are all under ""potash"" production.",
"StationaryProcess","Production of sodium phosphate",55421886,"Sodium Phosphate","Production of sodium phosphate","30501901;30501902;30501903;30501999",,99920300,,,,,,"just used phosphate rock",
"StationaryProcess","Production of TPAOH",55422298,"TPAOH","Production of TPAOH",30509201,,,,,,,,"tetrapropylammonium hydroxide",
"StationaryProcess","Ethylene Production Fossil Energy",55423007,"Bio Ethylene","Ethylene Production from Fossil Energy",30101803,,,,,,,,,
"StationaryProcess","Production of (NaPO3)6",55427436,"Sodium hexametaphosphate","Production of  (NaPO3)6","30501901;30501902;30501903;30501999",,99920300,,,,,,"just used phosphate rock",
"StationaryProcess","Production of SiO2 gel",55427776,"SiO2 gel","Production of SiO2 gel",65130001,,,,,,,,"Fumed silica is different to silica gel, but this is the only type of silica listed (although there is a code for industrial sand production 305027).",
"StationaryProcess","Production of ZSM-5",55428064,"ZSM-5","High octane gasoline via IDL,Production of ZSM-5","30509201;30509202;30509203;30509204;30509205",,,,,,,,"Just catalyst production",
"StationaryProcess","Lithium Carbonate Production in Chile",55601549,"Lithium Carbonate (Chile)","Production of lithium manganese oxide with Virgin Li2CO3 from Chile,Lithium iron phosphate (solid state),Production of lithium cobalt oxide (solid state),Lithium Carbonate Production in Chile,Production of LMR-NMC","30301001;30301002;30301004;30301009;30301010;30301011;30301012;30301013;30301014;30301021;30301022;30301023;30301024;30301025;30301099",,99920100,,,99950200,,,,
"StationaryProcess","Propylene Glycol Production from Glycerin (Algal Oil)",55605679,"Bio Propylene Glycol","Propylene Glycol Bioproduct from Glycerin (Algal Oil)",30120531,,,,,,,,"Process vent",
"StationaryProcess","1,3-Propanediol Production from Glycerin (Algal Oil)",55607019,"Bio 1,3-Propanediol","1,3-Propanediol Bioproduct from Glycerin (Algal Oil)",30206019,99910100,,,,,,,"This is the code for glycerin storage under biodiesel production. Maybe this glycerin could be used for propanediol?",
"StationaryProcess","3-Hydroxypropionic Acid Production from Glycerin (Algal Oil)-Distillation",55608848,"Bio 3-Hydroxypropionic Acid","3-Hydroxypropionic Acid Bioproduct from Glycerin (Algal Oil): Distillation,Acrylic Acid Bioproduct from 3-Hydropropionic Acid (Algal Oil)","30206013;30206015;30206021;30206025",99910100,,,,,,,,
"StationaryProcess","Acrylic Acid Production from 3-Hydroxypropionic Acid (Algal Oil)",55609458,"Bio Acrylic Acid","Acrylic Acid Bioproduct from 3-Hydropropionic Acid (Algal Oil)",30113221,,,,,,,,,
"StationaryProcess","Bio Ethylene Production from Ethanol (Corn Stover)",55609891,"Bio Ethylene","Ethylene Bioproduct from Ethanol (Corn Stover)",30101803,,,,,,,,"Ethylene can be made by dehydrating ethanol mixed with sulphuric acid, or in the gas phase with aluminium oxide. Who knows where or whether this takes place; the code I've given is for the production from fossil energy",
"StationaryProcess","Glycerin Production from Algal Oil",55615928,"Glycerin","Propylene Glycol Bioproduct from Glycerin (Algal Oil),3-Hydroxypropionic Acid Bioproduct from Glycerin (Algal Oil): Distillation,3-Hydroxypropionic Acid Bioproduct from Glycerin (Algal Oil): Electrodeionization,Acrylic Acid Bioproduct from 3-Hydropropionic Acid (Algal Oil),1,3-Propanediol Bioproduct from Glycerin (Algal Oil)",30206018,,,,,,,,,
"StationaryProcess","Polyethylene Production from Ethylene (Corn Stover)",55678667,"Polyethylene","Polyethylene Bioproduct from Ethylene (Corn Stover)",30101817,,,,,,,,,
"StationaryProcess","Sugars Production from Dilute Acid Pretrated (DAP) Corn Stover",55680910,"Sugars","Sugars Production from Dilute Acid Pretrated (DAP) Corn Stover",30205010,,,,,,,,,
"StationaryProcess","Isobutanol Production from Sugars (Corn Stover)",55682754,"Isobutanol","Isobutanol Bioproduct from Sugars (Corn Stover)","30205010;30205011;30205012;30205013;30205014;30205020;30205021;30205030;30205031;30205032;30205033;30205034;30205035;30205038;30205039;30205040;30205041;30205050;30205051;30205052;30205053;30205054;30205091",,,,,,,,"assume where ethanol is produced",
"StationaryProcess","Succinic Acid Production from Sugars (Corn Stover)",55683848,"Succinic Acid","Succinic Acid Bioproduct from Sugars (Corn Stover)",30113299,,,,,,,,,
"StationaryProcess","1,4-Butanediol Production from Succinic Acid (Corn Stover) and Ethanol (Corn)",55685122,"1,4-Butanediol","1,4-Butanediol Bioproduct from Succinic Acid (Corn Stover) and Ethanol (Corn)","30205010;30205011;30205012;30205013;30205014;30205020;30205021;30205030;30205031;30205032;30205033;30205034;30205035;30205038;30205039;30205040;30205041;30205050;30205051;30205052;30205053;30205054;30205091",,,,,,,,"Assume this happens where ethanol is produced",
"StationaryProcess","1,3-Propanediol Production from 3-Hydroxypropionic Acid (Algal Oil)",55685901,"Bio 1,3-Propanediol","1,3-Propanediol Bioproduct from 3-Hydroxypropionic Acid (Algal Oil)",40781605,99910100,,,,,,,"Propane storage",
"StationaryProcess","Produciton of activated carbon",55701072,"Activated carbon","Production of activated carbon","30100502;30100503;30100504;30100506;30100507;30100508;30100509;30100510;30100599",,,,,,,,"How different are activated carbon and carbon black? They're both paracrystalline carbon, but activated C has a higher surface area to volume. Is that it?",
"StationaryProcess","Production of alcohol synthesis catalyst",55701450,"Alcohol Synthesis Catalyst","Production of alcohol synthesis catalyst,High octane gasoline via IDL",30509203,,,,,,,,"From the GREET source for this process: The composition of the alcohol synthesis catalyst is approximated from U.S. Patent 4,882,360 (Stevens, 1989). It is assumed to be composed (all percentages given by weight) of 12% molybdenum oxide (MoO2), 2% potassium oxide (K2O), 11% cobalt oxide (CoO), and 68% carbon support (activated carbon). The remaining weight is assumed to be sulfur from hydrogen sulfide, which displaces oxygen during chemical reduction of the surface. The catalyst is prepared by contacting activated carbon with a hot aqueous solution of soluble Mo salt (i.e., ammonium heptamolybdate) and cobalt nitrate [Co(NO3)2] in a phosphoric acidic solution. After drying, the solids are contacted with the caustic KOH solution and subsequently dried. The resulting catalyst is then sulfided (Stevens, 1989).",
"StationaryProcess","Production of DEPG",55702116,"Dimethyl Ether of Polyethylene Glycol ","Production of Dimethyl Ether of Polyethylene Glycol ","40704897;40704898",,,,,,,,"DME isn't currently in widespread usage as a fuel",
"StationaryProcess","Production of tar reforming catalyst",55702385,"Tar reforming catalyst","Production of Tar reforming catalyst",30509201,,,,,,,,"This is catalyst production. Otherwise, tar dehydrator: 30300334",
"StationaryProcess","Production of Magnesium",55702907,"Magnesium","Production of Magnesium","30400601;30400605;30400650;30400699",,,,,,,,"There are many electrolysis processes listed for producing Mg. I can't see any specific thermal reduction process, though.",
"StationaryProcess","Production of Magnesium nitrate",55703149,"Magnesium Nitrate","Production of Magnesium nitrate,Production of Tar reforming catalyst",30400601,,,,,,,,"This is just magnesium: pot furnace",
"StationaryProcess","Production of Kaolin",55704422,"Kaolin","Production of Kaolin","30504102;30504103;30504115;30504119;30504129;30504130;30504131;30504132;30504139;30504140;30504141;30504142;30504149;30504150;30504151;30504170;30504171;30504172",,,,,,,,,
"StationaryProcess","Production of ZSM-5 catalsyt",55704637,"ZSM-5 catalyst","Production of ZSM-5 catalyst","30509201;30509202;30509203;30509204;30509205",,,,,,,,"Just catalyst production",
"StationaryProcess","Corn Stover Pretreatment by Dilute Acid (DAP)",55937914,"Corn Stover",,"30102701;30102704;30102705;30102706;30102707;30102708;30102709;30102710;30102711;30102712;30102713;30102714;30102717;30102720;30102722;30102723;30102724;30102725;30102727;30102728",,,,,99950100,,,,
"StationaryProcess","Switchgrass Pretreatment by Dilute Acid (DAP)",55938217,"Switchgrass",,2801000000,,,,99942100,,,,,
"StationaryProcess","Poplar Pretreatment by Dilute Acid (DAP)",55938797,"Poplar",,30205010,,,,,,,,,
"StationaryProcess","Miscanthus Pretreatment by Dilute Acid (DAP)",55938923,"Miscanthus",,2801000000,,,,99942060,,,,,
"StationaryProcess","Corn Stover Pretreatment by Ammonia Fiber Explosion (AFEX)",55939321,"Corn Stover",,2801000000,99910300,,,,,,,"AFEX doesn't really happen yet.",
"StationaryProcess","Switchgrass Pretreatment by Ammonia Fiber Explosion (AFEX)",55939544,"Switchgrass",,2801000000,99910300,,,,,,,"AFEX doesn't really happen yet.",
